{
  "$schema": "../contracts/model-profile.schema.json",
  "claim": "Observed mixed-host selectors with one shared instruction policy and native adapters. Exact overlay checks are bounded, not universal model quality or cross-host behavioral parity.",
  "context_policy": {
    "max_standing_bytes": {
      "codex": 2048,
      "hermes": 2048,
      "omp": 2048
    },
    "recovery_loaded_into_prompt": false,
    "skills": "on-demand",
    "tools": "host-native-on-demand"
  },
  "contracts": {
    "recovery_manifest": "recovery/current/manifest.json",
    "surfaces": "contracts/instruction-surfaces.json",
    "units": "contracts/instruction-units.json"
  },
  "evidence": [
    "evals/results/current-model-instruction-profile-deterministic.json",
    "evals/results/astra-foreground-observed.json",
    "evals/results/hermes-continuation-current-artifacts.json",
    "evals/results/prompt-sentence-review.json"
  ],
  "hosts": {
    "codex": {
      "artifact_sha256": [
        "11d38803b75dd625966f81939fcfb4f04699f52cca0b4beecf91f2c077908778"
      ],
      "effective_surfaces": [
        "provider.native-system",
        "portable.reconciliation-authority",
        "codex.runtime-native",
        "codex.user-global",
        "codex.project-context"
      ],
      "effective_units": [
        "codex.output",
        "codex.instruction-authoring",
        "codex.scope",
        "codex.evidence",
        "codex.research",
        "codex.reconciliation",
        "codex.execution"
      ],
      "model": "gpt-6-astra",
      "provider": "openai-codex",
      "reasoning": "low",
      "runtime": "codex-cli 0.155.0-alpha.16.4"
    },
    "hermes": {
      "artifact_sha256": [
        "24afe3566d3e3e1bd6dbd80a2e90d3f239fb468856bb3ad49bdb7b87a6326f3d"
      ],
      "effective_surfaces": [
        "provider.native-system",
        "portable.reconciliation-authority",
        "hermes.runtime-native",
        "hermes.user-global",
        "hermes.project-context"
      ],
      "effective_units": [
        "hermes.style",
        "hermes.judgment",
        "hermes.output",
        "hermes.deliberation",
        "hermes.instruction-authoring-route",
        "hermes.reconciliation",
        "hermes.execution"
      ],
      "model": "gpt-6-astra",
      "provider": "openai-codex",
      "reasoning": "low",
      "runtime": "Hermes Agent 0.21.4"
    },
    "omp": {
      "artifact_sha256": [],
      "effective_surfaces": [
        "provider.native-system",
        "portable.reconciliation-authority",
        "omp.runtime-native",
        "omp.project-context"
      ],
      "effective_units": [],
      "no_managed_standing_reason": "OMP 18.2.6's Codex discovery provider is not enabled (enabledProviders is empty); fresh native get_state omits the managed standing markers, and no native OMP user-global AGENTS.md is installed.",
      "reasoning": "xhigh",
      "runtime": "omp 18.2.6"
    }
  },
  "id": "gpt-6-astra-openai-codex",
  "retest_on": [
    "model-release",
    "provider-changed",
    "runtime-changed",
    "prompt-assembly-changed",
    "tool-schema-changed",
    "context-policy-changed",
    "instruction-changed"
  ],
  "schema_version": 1,
  "status": "superseded",
  "target": {
    "model": "gpt-6-astra",
    "provider": "openai-codex",
    "reasoning": "host-specific"
  },
  "writing_routes": {
    "model-facing-instructions": {
      "loading": "on-demand",
      "owner": "skills/instruction-authoring",
      "scope": "Dense model-facing rules, skills, triggers, references, and proportional behavior evaluation."
    },
    "public-prose": {
      "loading": "on-demand",
      "owner": "skills/humanizer",
      "scope": "Issues, PRs, release notes, email, Slack, posts, and explicit humanization."
    },
    "surface-placement": {
      "loading": "on-demand",
      "owner": "skills/hermes-self-engineering",
      "scope": "Resolve unclear Hermes persistence placement; not a prerequisite for known-owner instruction edits."
    }
  }
}
