{
  "$schema": "../contracts/model-profile.schema.json",
  "schema_version": 1,
  "id": "gpt-5.6-sol-openai-codex",
  "status": "superseded",
  "claim": "Definitive user-owned standing instruction overlay for the named model/provider stack; provider-hidden and runtime-native system instructions remain externally owned and are identified rather than copied.",
  "target": {
    "model": "gpt-5.6-sol",
    "provider": "openai-codex",
    "reasoning": "host-specific"
  },
  "contracts": {
    "surfaces": "contracts/instruction-surfaces.json",
    "units": "contracts/instruction-units.json",
    "recovery_manifest": "recovery/current/manifest.json"
  },
  "hosts": {
    "hermes": {
      "runtime": "Hermes Agent 0.21.0",
      "reasoning": "medium",
      "effective_surfaces": [
        "provider.native-system",
        "portable.reconciliation-authority",
        "hermes.runtime-native",
        "hermes.user-global",
        "hermes.project-context"
      ],
      "effective_units": [
        "hermes.identity",
        "hermes.style",
        "hermes.judgment",
        "hermes.output",
        "hermes.deliberation",
        "hermes.instruction-authoring-route",
        "hermes.reconciliation"
      ],
      "artifact_sha256": [
        "52cbc855943d78ae1904938018166c665b1113c60db5081a1f6dd7eb323265ef"
      ]
    },
    "codex": {
      "runtime": "codex-cli 0.153.1",
      "reasoning": "medium",
      "effective_surfaces": [
        "provider.native-system",
        "portable.reconciliation-authority",
        "codex.runtime-native",
        "codex.user-global",
        "codex.session-start-hook",
        "codex.project-context"
      ],
      "effective_units": [
        "codex.output",
        "codex.instruction-authoring",
        "codex.scope",
        "codex.evidence",
        "codex.research",
        "codex.reconciliation"
      ],
      "artifact_sha256": [
        "8e78024a9a7c6bdcf24df92a4f5bb5a496d2634d7a1beb2a8e8687fcfb1c0953"
      ]
    },
    "omp": {
      "runtime": "omp 17.2.13",
      "reasoning": "high",
      "effective_surfaces": [
        "provider.native-system",
        "portable.reconciliation-authority",
        "omp.runtime-native",
        "omp.project-context"
      ],
      "effective_units": [],
      "artifact_sha256": [],
      "no_managed_standing_reason": "OMP 18.1.10's Codex discovery provider is not enabled, and no native OMP user-global AGENTS.md is installed."
    }
  },
  "writing_routes": {
    "public-prose": {
      "owner": "skills/humanizer",
      "loading": "on-demand",
      "scope": "Issues, PRs, release notes, email, Slack, posts, and explicit humanization."
    },
    "model-facing-instructions": {
      "owner": "skills/instruction-authoring",
      "loading": "on-demand",
      "scope": "Dense model-facing rules, skills, triggers, references, and proportional behavior evaluation."
    },
    "surface-placement": {
      "owner": "skills/hermes-self-engineering",
      "loading": "on-demand",
      "scope": "Select the narrowest persistent Hermes behavior surface before instruction authoring."
    }
  },
  "context_policy": {
    "recovery_loaded_into_prompt": false,
    "skills": "on-demand",
    "tools": "host-native-on-demand",
    "max_standing_bytes": {
      "hermes": 2048,
      "codex": 2048,
      "omp": 2048
    }
  },
  "retest_on": [
    "model-release",
    "provider-changed",
    "runtime-changed",
    "prompt-assembly-changed",
    "tool-schema-changed",
    "context-policy-changed",
    "instruction-changed"
  ],
  "evidence": [
    "evals/results/current-model-instruction-profile-deterministic.json"
  ]
}
